{
  "$schema": "../contracts/component-input.schema.json",
  "contractVersion": "1.0",
  "component": "orchestrator",
  "operation": "generate",
  "workspace": {
    "root": ".",
    "mode": "project"
  },
  "request": {
    "steps": [
      {
        "component": "validator",
        "operation": "validate",
        "request": {}
      }
    ]
  },
  "policy": {
    "strict": true,
    "overwrite": "deny",
    "network": "deny",
    "minecraftVersion": "1.20.4",
    "validateReferences": true
  }
}
