{
  "$schema": "../contracts/component-input.schema.json",
  "contractVersion": "1.0",
  "component": "job",
  "operation": "generate",
  "workspace": {
    "root": ".",
    "mode": "standalone"
  },
  "request": {
    "key": "示例职业",
    "skills": [],
    "experience": "default"
  },
  "policy": {
    "strict": true,
    "overwrite": "deny",
    "network": "deny",
    "minecraftVersion": "1.20.4",
    "validateReferences": false
  }
}
