{
  "$schema": "../contracts/component-input.schema.json",
  "contractVersion": "1.0",
  "component": "station",
  "operation": "generate",
  "workspace": {
    "root": ".",
    "mode": "standalone"
  },
  "request": {
    "key": "示例中转站",
    "event": "Player Damage Pre",
    "priority": "NORMAL",
    "async": false,
    "actions": "true"
  },
  "policy": {
    "strict": true,
    "overwrite": "deny",
    "network": "deny",
    "minecraftVersion": "1.20.4"
  }
}
