{
  "$schema": "../contracts/component-input.schema.json",
  "contractVersion": "1.0",
  "component": "ability",
  "operation": "generate",
  "workspace": {
    "root": ".",
    "mode": "standalone"
  },
  "request": {
    "key": "示例技能",
    "type": "DIRECT",
    "actions": "true"
  },
  "policy": {
    "strict": true,
    "overwrite": "deny",
    "network": "deny",
    "minecraftVersion": "1.20.4"
  }
}
